{
  "schema_version": "load-requirement-1.0",
  "context_tokens": 1048576,
  "peak_concurrent_sequences": 30,
  "request_rate_per_second": 0,
  "input_tokens_per_request": 0,
  "output_tokens_per_request": 0,
  "prefill_tokens_per_second": 0,
  "decode_tokens_per_second": 0,
  "target_utilization": 0.8,
  "target_ttft_ms": null,
  "target_tpot_ms": null,
  "target_latency_percentile": null,
  "measured_profile": null
}
